cuce,entidad,tipo_de_contratacion,modalidad,objeto_de_contratacion,estado,fecha_presentacion,fecha_publicacion,archivos,formularios,ficha_del_proceso,persona_contacto,garantia,costo_pliego,arpc,reunión_aclaracion,fecha_adjudicacion_desierta,departamento,normativa
20-0086-10-1032812-1-1,Ucep Mi Riego,Consultoria,OF,"Estudio De Diseño De Preinversion Proyecto ""Construcción Presa Achaca Caluyo (Tiahuanacu)",Suspendido,2020-03-30,2020-03-04,Documento Base de ContratacionConvocatoriaActa Reunion de AclaracionResolucion de aprobacion del DBCResolucion/Documento de Suspension,FORM 100FORM 120FORM 100-E,Ver Ficha,Yaquelyn Ugarte Rivera (Telf: 2145792), ,,   - ,13/03/2020 10:00,,La Paz,Otra Normativa especifica
20-0086-10-1033284-1-1,Ucep Mi Riego,Consultoria,OF,Elaboración De Planes De Aprovechamiento Hídrico Local,No Informado,2020-03-20,2020-03-05,Documento Base de ContratacionConvocatoriaFormularios de presentacion,FORM 100,Ver Ficha,Maria Calcinas Quispe (Telf: 2145792), ,,   - , ,,La Paz,BID
20-0086-10-1034856-1-1,Ucep Mi Riego,Consultoria,OF,"Auditoria De Los Estados Financieros Del Programa Mas Inversión Para El Riego Ii - Mejora Del Riego Tradicional Y Tecnificado (Mi Riego Ii), Contrato De Préstamo Cfa N° 9757
Por El Periodo Comprendido Del 01 De Enero Al 31 De Diciembre De 2019",Suspendido,2020-03-26,2020-03-11,Documento Base de ContratacionConvocatoriaResolucion de aprobacion del DBCActa Reunion de AclaracionResolucion/Documento de Suspension,FORM 100FORM 120FORM 100-E,Ver Ficha,Maria Calcinas Quispe (Telf: 2145792), ,,   - ,16/03/2020 10:30,,La Paz,Otra Normativa especifica
20-0086-10-1034890-1-1,Ucep Mi Riego,Consultoria,OF,Auditoria De Los Estados Financieros Del Programa Presas - Contrato De Préstamo Cfa 9759,Suspendido,2020-03-26,2020-03-11,ConvocatoriaDocumento Base de ContratacionResolucion de aprobacion del DBCResolucion de aprobacion del DBCActa Reunion de AclaracionResolucion/Documento de Suspension,FORM 100FORM 120FORM 100-E,Ver Ficha,Jose Oscar Arteaga Franco (Telf: 2145792), ,,   - ,16/03/2020 10:30,,La Paz,Otra Normativa especifica
20-0086-10-1034823-1-1,Ucep Mi Riego,Consultoria,OF,"Auditoria De Los Estados Financieros Del Programa Mas Inversión Para Mi Riego ? Mi Riego, Por El Ejercicio Terminado Al 31/12/2019 - Contrato De Préstamo Cfa 8785",Suspendido,2020-03-26,2020-03-11,Documento Base de ContratacionConvocatoriaActa Reunion de AclaracionResolucion de aprobacion del DBCResolucion de aprobacion del DBCResolucion/Documento de Suspension,FORM 100FORM 120FORM 100-E,Ver Ficha,Yaquelyn Ugarte Rivera (Telf: 2145792), ,,   - ,16/03/2020 10:30,,La Paz,Otra Normativa especifica
20-0086-10-1035271-0-E,Ucep Mi Riego,Consultoria,CM,Consultoría Individual De Linea: Ingeniero Civil Ix Ucep Mi Riego Regional Cochabamba Santa Cruz,Contratado,,2020-03-12,InformeRes. de Adjudicacion (nota)Contrato/Orden de Compra/Orden de Servicio,FORM 400,Ver Ficha,Yaquelyn Ugarte Rivera (Telf: 2145792), ,,   - , ,2020-01-17,La Paz,NB-SABS (D.S.0181)
20-0086-10-1035225-0-E,Ucep Mi Riego,Consultoria,CM,Ingeniero Agronomo I Regional Oruro Del Departamento De Oruro - Ucep Mi Riego Caf 9757,Contratado,,2020-03-12,InformeContrato/Orden de Compra/Orden de ServicioRes. de Adjudicacion (nota),FORM 400,Ver Ficha,Yaquelyn Ugarte Rivera (Telf: 2145792), ,,   - , ,2020-01-20,La Paz,NB-SABS (D.S.0181)
20-0086-10-1038140-0-E,Ucep Mi Riego,Consultoria,OF,Responsable Regional La Paz - Ucep Mi Riego,Contratado,,2020-04-13,Res. de Adjudicacion (nota)Contrato/Orden de Compra/Orden de Servicio,FORM 400,Ver Ficha,Jose Oscar Arteaga Franco (Telf: 2145792), ,,   - , ,2020-03-04,La Paz,Otra Normativa especifica
20-0086-10-1039218-0-E,Ucep Mi Riego,Consultoria,OF,"Paquete 16 Estudio De Diseño Técnico De Preinversion ""Construcción Sistema De Riego Yascapi (Puna)-Ajuste Y Complementación Del Estudio A Nivel Edtp ""Construcción Sistema De Riego Camani, Azuriri Y Vilacasca (Caripuyo)",Contratado,,2020-04-29,Contrato/Orden de Compra/Orden de ServicioRes. de Adjudicacion (nota),FORM 400,Ver Ficha,Yaquelyn Ugarte Rivera (Telf: 2145792), ,,   - , ,2020-02-12,La Paz,BID
20-0086-10-1040242-0-E,Ucep Mi Riego,Consultoria,OF,"Paquete 7: Estudio De Diseño Técnico De Preinversion ""Construcción Sistema De Riego Carlos Machicao (Tomave)"" Y Estudio De Diseño Técnico De Preinversion ""Construcción Sistema De Riego Suycu Chacra (Tupiza)""",Contratado,,2020-05-13,Res. de Adjudicacion (nota)Contrato/Orden de Compra/Orden de Servicio,FORM 400,Ver Ficha,Yaquelyn Ugarte Rivera (Telf: 2145792), ,,   - , ,2020-02-18,La Paz,BID
20-0086-10-1041950-0-E,Ucep Mi Riego,Consultoria,CM,Consultoría Individual De Linea: Ingeniero Civil Preinversion Para La Ucep Mi Riego,Contratado,,2020-05-28,Res. de Adjudicacion (nota)InformeContrato/Orden de Compra/Orden de Servicio,FORM 400,Ver Ficha,Yaquelyn Ugarte Rivera (Telf: 2145792), ,,   - , ,2020-03-10,La Paz,NB-SABS (D.S.0181)
20-0086-10-1041930-0-E,Ucep Mi Riego,Consultoria,CM,Técnico Vi Administrativo Financiero Ucep Mi Riego,Contratado,,2020-05-28,InformeRes. de Adjudicacion (nota)Contrato/Orden de Compra/Orden de Servicio,FORM 400,Ver Ficha,Yaquelyn Ugarte Rivera (Telf: 2145792), ,,   - , ,2020-03-04,La Paz,NB-SABS (D.S.0181)
20-0086-10-1041594-0-E,Ucep Mi Riego,Consultoria,CM,Consultor De Linea: Chofer Mensajero Ucep Mi Riego Regional Cochabamba-Santa Cruz,Contratado,,2020-05-28,Res. de Adjudicacion (nota)Contrato/Orden de Compra/Orden de ServicioInforme,FORM 400,Ver Ficha,Yaquelyn Ugarte Rivera (Telf: 2145792), ,,   - , ,2020-03-06,La Paz,NB-SABS (D.S.0181)
20-0086-10-1042268-1-1,Ucep Mi Riego,Consultoria,OF,"Consultoria Por Producto Estrategia De Articulación De Objetivos Del Programa Presas, Con Políticas Y Estrategias De Gestión Forestal Sostenible Y Gestión De Áreas Protegidas",Adjudicado,2020-06-04,2020-05-29,Documento Base de ContratacionConvocatoriaInforme de la Comision/Responsable de EvaluacionRes. de Adjudicacion (nota)Resolución/Nota/Documento que autorice la Ampliacion,FORM 100FORM 170FORM 100-E,Ver Ficha,Yaquelyn Ugarte Rivera (Telf: 2145792), ,,   - , ,2020-06-10,La Paz,Otra Normativa especifica
20-0086-10-1042262-1-1,Ucep Mi Riego,Consultoria,OF,"Consultoria Por Producto Estrategia De Articulación De Objetivos Del Programa Presas, Con Políticas Nacionales De Desincentivo Al Chaqueo Y Quema, E Identificación De Medidas De Fortalecimiento De Instancias De Regulación",Adjudicado,2020-06-04,2020-05-29,ConvocatoriaDocumento Base de ContratacionRes. de Adjudicacion (nota)Informe de la Comision/Responsable de EvaluacionResolución/Nota/Documento que autorice la Ampliacion,FORM 100FORM 170FORM 100-E,Ver Ficha,Yaquelyn Ugarte Rivera (Telf: 2145792), ,,   - , ,2020-06-10,La Paz,Otra Normativa especifica
20-0086-10-1042772-0-E,Ucep Mi Riego,Consultoria,CM,Asesor Legal Caf Ucep Mi Riego,Contratado,,2020-06-02,Res. de Adjudicacion (nota)InformeContrato/Orden de Compra/Orden de Servicio,FORM 400,Ver Ficha,Yaquelyn Ugarte Rivera (Telf: 2145792), ,,   - , ,2020-04-02,La Paz,NB-SABS (D.S.0181)
20-0086-10-1046179-1-1,Ucep Mi Riego,Consultoria,OF,Ingeniero Civil En Temas Especializados Bo-L1188,Adjudicado,2020-07-03,2020-06-23,ConvocatoriaDocumento Base de ContratacionEnmiendasRes. de Adjudicacion (nota)Informe de la Comision/Responsable de EvaluacionInforme de la Comision/Responsable de Evaluacion,FORM 100FORM 170,Ver Ficha,Jose Oscar Arteaga Franco (Telf: 2145792), ,,   - , ,2020-07-29,La Paz,Otra Normativa especifica
20-0086-10-1052804-1-1,Ucep Mi Riego,Consultoria,OF,Diagnóstico Arqueológico Proyecto: ?Obras Para El Control De Deslizamientos Cuenca Alpacoma ? Torrentera Titiri?,En curso,2020-08-10,2020-07-31,ConvocatoriaDocumento Base de ContratacionEnmiendas,FORM 100,Ver Ficha,Yaquelyn Ugarte Rivera (Telf: 2145792), ,,   - , ,,La Paz,BID
20-0086-10-1052806-1-1,Ucep Mi Riego,Consultoria,OF,Diagnóstico Arqueológico Proyecto: ?Construcción De Obras Para La Reducción De Riesgos Y Adaptación Al Cambio Climático ? Sipe Sipe Fase I?,En curso,2020-08-10,2020-07-31,ConvocatoriaDocumento Base de ContratacionEnmiendas,FORM 100,Ver Ficha,Yaquelyn Ugarte Rivera (Telf: 2145792), ,,   - , ,,La Paz,BID
20-0086-10-1052807-1-1,Ucep Mi Riego,Consultoria,OF,Diagnostico Arqueológico Proyecto 'Construcción De Obras Para La Reducción De Riesgos Y Adaptación Al Cambio Climático - Municipio De Vinto Fase I,En curso,2020-08-10,2020-07-31,Documento Base de ContratacionConvocatoriaEnmiendas,FORM 100,Ver Ficha,Yaquelyn Ugarte Rivera (Telf: 2145792), ,,   - , ,,La Paz,BID
